topic	title
domestic policy/politics	CNN Compares The Trump Administration To Genocidal Nazi Germany
election general	"Pollster: It's Curious How Biden Underperformed Hillary Clinton In Every City...Except These Four: Milwaukee, Detroit, Atlanta and Philadelphia."
domestic policy/politics	MSNBC\u2019s exodus to work for Joe Biden shows it\u2019s been shilling for him all along
election challenge	"Rep. Louie Gohmert, (R-TX): Foreign company had evidence of 'vote switching' -- Server 'seized' by U.S. Army forces after he gave information to President Trump"
election challenge	Fox\u2019s Wallace: Trump Can\u2019t \u2018Credibly\u2019 Say the Election Was Taken from Him \u2014 No \u2018Serious Fraud\u2019
domestic policy/politics	An MRC study finds that 4.6% of Joe Biden voters would NOT have voted for him had they known about the Biden family's corrupt business dealings.
election challenge	"Wisconsin lawsuit seeks to toss 800,00 ballots -- Biden leads by 20,000 votes in state"
election challenge	"Trump Tweet: Our election was hijacked. There is no question. Congress has a duty to #ProtectOurDemocracy &amp; #FollowTheFacts.... oh, wait, that was Nancy Pelosi in 2017."
election general	BREAKING: President Trump Makes Surprise Appearance As Thousands March In DC To Show Their Support For Him\u2026#MarchForTrump
foreign relations	Retiring diplomat says defense officials misled Trump on troop count in Syria
foreign relations	"Law Firm That Dropped Trump Advises CCP-Linked Firms, Aided In Outsourcing U.S. Jobs To China"
election challenge	Media's hiding of Hunter Biden scandal robbed Trump of clear win: Poll
election general	"President Trump wins North Carolina, hits 232 electoral votes"
election general	Thousands flock to DC for pro-Trump rally
election challenge	"Three Wisconsin Voters Band Together, File Election Lawsuit That Could Give Trump An Easy Win"
domestic policy/politics	Journalist Glenn Greenwald Rips 'The Most Pathological Liar' in Politics and Other Dems for Burying Hunter Biden Fiasco
domestic policy/politics	South Dakota Gov. Kristi Noem won't comply if Biden pursues national mask mandate
election general	Hillary Clinton Supporter Alan Dershowitz: 'Trump Will Win the Pennsylvania Lawsuit'
election challenge	"Trump Team to Call Million Plus Voters about Anomalies in 6 Contested States. \u201cWe\u2019re calling them to confirm whether or not they actually cast the ballot, or if that ballot was cast by somebody else in their name\u201d"
domestic policy/politics	"This is disturbing. Facebook removed the title of \u201cPresident\u201d from Donald Trump and designated him as \u201cPolitical Candidate.\u201d Trump is still president and, no matter what happens, will remain so until Inauguration Day"
domestic policy/politics	Plan B? Trump could receive second term from U.S. House in 'contingent election'
election general	"If Media Didn't Think Trump Could Win, It Wouldn't be Targeting his Lawyers"
election general	Trump drives by supporters at DC march
election general	President Trump Drives by Supporters in DC for 'Million MAGA March'. 'Chants of \u201cUSA! USA!\u201d \u201cWe want Trump! We want Trump!\u201d and \u201cFour more years! Four more years!\u201d could be heard.'
election challenge	"If All the Fraud Is Uncovered, Trump Will Win -- How do we know? The people who tried to pull off this election heist are drawn from the same swamp as the conspirators in the Russia hoax."
pandemic	South Dakota Gov. Kristi Noem Wouldn\u2019t Enforce a Biden National Lockdown
domestic policy/politics	Trump said the vaccine will be available to everyone by April -- except residents in New York state where the governor has decided not to \u201cfor political reasons.\u201d
election general	"Trump talks post-election fight: Trump says he's confident he will win the states needed to get to 270 electoral votes, \""Never bet against me.\"""
election general	Trump wins North Carolina
domestic policy/politics	Obama's WH Physician Issues Brutal Statement on Biden's Mental Health.
election general	"Gambling sites refuse to call election for Biden, leaving $600 million in limbo"
election general	Trump got more NYC votes in 2020 \u2014 including in the South Bronx
foreign relations	Senior Administration Officials Lied To Trump About Troop Levels So He Wouldn\u2019t Pull Out Of Syria
election general	Alan Dershowitz Predicts Trump SCOTUS Win in Pennsylvania Ballot Case
election challenge	Trump puts Giuliani in charge of election lawsuits: report
election challenge	Poll: Media's hiding of Hunter Biden scandal robbed Trump of clear win
domestic policy/politics	Former Reddit CEO Wants Trump SIlenced Online to Stop \u2018A Coup\u2019
election general	How President Trump Surprised 'Million MAGA March' Participants
domestic policy/politics	Democratic congresswoman compliments way Trump 'doesn't talk down to people' unlike some 'woke' Democrats
domestic policy/politics	Kyle Rittenhouse's Mother Tears Into Joe Biden for Smearing Her Son as a White Supremacist
domestic policy/politics	A dark look into Biden's America: Norway criminalizes private criticism of LGTBQ people
domestic policy/politics	Jon Voight Condemns the 'Lie' of a Biden Win Amid America's 'Battle of Righteousness Versus Satan' -- Who would\u2019ve ever guessed one of the biggest supporters of the Republican Commander-in-Chief would be\u2026Brad Pitt\u2019s father-in-law?
domestic policy/politics	Biden Says He Is Considering Adding Metamucil To His Cabinet
election general	Pelosi vows to teach Trump-less McConnell a lesson despite shrunken House majority
domestic policy/politics	WATCH: CNN Runs Segment Comparing Trump To Nazis Purging Jews | The Daily Wire
domestic policy/politics	"Family Income Rose Drastically Under Trump, Meaning His Economy Was Better Than Obama\u2019s"
domestic policy/politics	Organization That Made Public Blacklist of Trump Supporters Shuts Down After Massive Backlash
election general	"Watch Live: Pro-Trump Rally in Washington, DC"
domestic policy/politics	Harmeet Dhillon: GOP Paid Millions to Lawyers Who Abandoned Trump
foreign relations	Juliet Samuel: The American era is over if Biden abandons President Trump's toughness on China
election challenge	Pollsters Failed to Detect Trump Support from Educated Whites
election challenge	Trump campaign wins Pennsylvania lawsuit to block ballots that lacked ID
election general	Trump Confident He'll Get More Than 270 Electoral College Votes. 'Never Bet Against Me'
foreign relations	Will Israel attack Iran before Trump leaves office? | Spectator USA
domestic policy/politics	Obama: 'Americans spooked by black man in White House' led to Trump presidency
domestic policy/politics	Twitter removes Lincoln Project post that doxxed lawyers representing Trump
election challenge	Trump's campaign drops Arizona results lawsuit - report
domestic policy/politics	Left-Wing Activist Group Launches Strategic Harassment Campaign Targeting Trump Election Lawyers
election challenge	Georgia's vote counting software suspected of having pro-Biden bug -- 'A curious thing happened' in Fulton County
election general	"Hillary in Aug.: \""Joe Biden should not concede under any circumstances. We've got to have a massive legal operation.\"""
pandemic	"Lori Lightfoot Defends Attending Joe Biden Street Parties But Calling for Canceling Thanksgiving: \""There are times when we actually do need to have relief and come together, and I felt like that was one of those times.\"""
election challenge	Michigan Judge Denies Trump Backers\u2019 Bid to Toss Detroit Votes
election general	"Trump Team: Americans Owed a Fair Election. \u201cThey deserve to know that every legal vote is counted, and that every illegal vote is not counted.\u201d"
election general	Cancel Culture has finally reached the courtroom: Trump campaign lawyers pressured to quit case in Pennsylvania
foreign relations	Iran-backed Terrorist Groups in Iraq Cheer Prospect of Biden Presidency
election general	Alan Dershowitz Predicts Trump Will Win Pennsylvania Lawsuit | The Daily Wire
domestic policy/politics	Progress: Biden Administration To Apply 'Black Lives Matter' Decals To All Attack Drones
domestic policy/politics	Anti-Trump Lions in the Press Turn Into Cuddly Biden Kittens
election general	Trump: Might 'Stop By' DC Rallies for Election Integrity this Weekend
election challenge	"Developing: Milwaukee Elections Chief Lost Elections Flash Drive In Morning Hours Of November 4th When Democrats Miraculously Found 120,000 Votes For Joe Biden"
election general	Tucker Carlson on Biden Transition: 'Not an Incoming Presidential Administration --- A Corporate Takeover of the Country'
election general	"Exit Polls showed military and veteran voters favored Trump to Biden 52-45. However, other polling suggests younger veteran voters preferred Biden 51-40. In 2016, veteran voters favored Trump over Clinton 60-34."
domestic policy/politics	Biden\u2019s Pentagon Transition Team Members Funded By The Arms Industry
election general	The lawless fantasy to oust all the election lawyers of Donald Trump
pandemic	Trump Admin. strikes deal to make COVID-19 vaccine free at major pharmacies and the MSM hasn't really covered this
foreign relations	Biden Considers Hillary Clinton To Serve As US Envoy To United Nations
foreign relations	Joe Biden announces Greta Thunberg will head Climate Change Task Force (Satire)
pandemic	Gov. Tate Reeves Signals Mississippi Wouldn\u2019t Comply with a Biden Mandatory Six-Week National Lockdown
election general	Lawyer behind Trump's legal campaign to win Pa. has a long history in Philly
domestic policy/politics	Biden Reveals New Plans For Space Force To Bomb Space Middle East (For The Space Oil)
domestic policy/politics	Obama: Paranoia about 'black man in White House' drove voters to Trump
domestic policy/politics	Biden considering Yellen as possible Treasury secretary: report
election general	Anarchist and anti-fascist groups planning to 'overwhelm' 'Million MAGA March' in DC \u2014 Trump hints at attending
election general	"Examining the code, internet geeks conclude 'Trump's win was yuuuge'"
election general	Can you really blame Trump supporters for refusing to accept the election result? | Spectator USA
domestic policy/politics	Ala. Sen.-elect Tommy Tuberville labels Biden a socialist | One America News Network
election general	"Trump talks post-election fight: The bottom line: No matter what news organizations have projected, Trump says he's confident he will win the states needed to get to 270 electoral votes. He quickly ran through the situation in six states."
election general	Amend the constitution to prevent another President Trump. FFS.
foreign relations	Trump Signs New Executive Order Targeting Investments in Chinese Companies -- Specifically bars US investment in companies with ties to China's military.
domestic policy/politics	"Biden Administration to target Domestic \""Terrorism\"""
election general	Law firm Porter Wright withdraws from representing Trump in Pennsylvania case
domestic policy/politics	Joe Biden's Disastrous Record of Using 'Bold Federal Action' To Solve America's Problems
domestic policy/politics	"More than two dozen Fortune 500 CEOs held a secret video conference to discuss collective action if Trump refuses to leave office, conducts mass firings in government or holds rallies which become 'seditious riots'"
domestic policy/politics	"Joseph Epstein: Donald Trump, the President His Detractors Loved to Hate"
election general	L. Lin Wood Says 100% Trump will stay president and the legal evidence is overwhelming (22 mins in)
foreign relations	Report: Biden Considering Hillary Clinton For UN Ambassador
foreign relations	"Beijing Is Called For Biden, The Big Guy Wins China"
domestic policy/politics	Bill Galston: President Trump Remade His Party and the World
domestic policy/politics	"Pentagon shake-up to help cement Trump's legacy, bringing troops home and taking out enemies, White House source says"
election challenge	"Judge sides with Trump, barring Pennsylvania from extending voter ID deadline -- A portion of mail-in ballots from voters who had failed to provide ID by Nov. 9 should not be counted."
foreign relations	"Pope Congratulates 'Deeply Devout' Catholic Biden, Who Calls Abortion an 'Essential Health Care Service'"
domestic policy/politics	Democrat Senator Joe Manchin tweets that Democrats do not want to defund the police and do not have a socialist agenda and AOC tweets a photo of herself glaring at him during a SOTU speech by Trump.
foreign relations	"Pope Francis, Frequent Trump Critic, Congratulates Biden | The Daily Wire"
foreign relations	Mexico\u2019s President Declines to Acknowledge Biden as President-Elect
election general	The Real Resistance - The 70million people who voted for Trump are revolting against the new elites.
foreign relations	Hispanic Networks Triggered by Mexican President Refusal to Acknowledge Biden as President-Elect
domestic policy/politics	The National Urging Plan: Biden Appears To Downgrade His Mask Pledge From A \u201cMandate\u201d To An \u201cUrging\u201d
election challenge	"BREAKING: PA Judge Rules In Favor Of Trump Campaign, Says State MAY NOT Count Ballots Where Voters Failed To Provide Proof Of Identification"
election challenge	Why President Trump Has A Strong Supreme Court Case To Contest Pennsylvania
pandemic	"Joe Biden's COVID-19 board co-chair says US lockdown unlikely under new administration but pushed for targeted intervention, using the example of New York City's cracking down on hotspots by the zip code instead of enforcing citywide shutdowns."
foreign relations	Outgoing Syria Envoy Admits Hiding US Troop Numbers; Praises Trump\u2019s Mideast Record
foreign relations	Potential Biden Cabinet Pick a Frequent Guest on Chinese Propaganda Outlets
election challenge	"Trump Campaign, Georgia GOP Highlight Major Concerns over Recount"
election general	Trump lawyers withdraw from key Pennsylvania case challenging vote count
election challenge	Did Dominion Delete 2.7 Million Trump Votes?
domestic policy/politics	"Biden set to roll back Trump rules on abortion funding, religious exemptions in ObamaCare"
domestic policy/politics	Arizona Secretary of State Referred to Trump's 'Base' as 'Neo-Nazi' in 2017
domestic policy/politics	First black woman crowned Miss USA deemed \u2018gun-loving Trump fan\u2019 and the left can\u2019t handle
domestic policy/politics	"Joe Biden\u2019s cancer charity spent more than $3.7million on staff salaries but distributed ZERO towards research grants over two years, tax filings reveal"
election general	More Protective MAGA Helmets Now Available For Trump Supporters Brave Enough To Go Out In Public
election general	Biden Called Out For Silence As Leftists Attack Pro-Trump Demonstrators In Nation\u2019s Capital | The Daily Wire
election general	"Twitter Claims Trump Conceded, He Counters: \u201cI concede NOTHING!\u201d"
pandemic	Fauci Showed Breakthrough Pfizer COVID Vaccine Results To Biden Before Trump
election general	"Elderly Trump supporter attacked, protesters shoot fireworks at diners, surround hotel of Million MAGA March attendees"
domestic policy/politics	South Dakota Gov. Noem Won't Enforce Biden's Mask Mandate Tyranny
election general	Trump: Antifa Waited Until Most People Left MAGA Rally to Attack
election general	"Sharyl Attkisson: Media plotted to destroy Trump, cover for Biden"
domestic policy/politics	Professor: Trump rose because government hasn\u2019t served the people
domestic policy/politics	"Biden cancer \""charity\"" spent millions on salaries, zero on research"
domestic policy/politics	Georgia Senate candidate Raphael Warnock: People in US need to 'repent' for Trump and 'worship of whiteness'
election general	"What\u2019s the most expensive tweet in Twitter history? I nominate Kathryn Murdoch\u2019s post-election tweet, \u201cWe did it!\u201d The corruption of Fox News triggers flashbacks to the fall of the former dissident website Drudge Report, which went full Never Trump."
election general	Watching the footage of all the violence against Trump supporters in DC got me like...
pandemic	Fury as Mayor tells Chicago to CANCEL Thanksgiving over Covid\u2026days after celebrating Biden win maskless in crowd
election general	Let's get ready to RATIOOO! Dems claiming Biden will 'restore the soul of this nation' as Biden supporters BEAT on Trump supporters in DC BACKFIRES
domestic policy/politics	"Tax filings reveal Biden cancer charity spent millions on salaries, zero on research"
election challenge	Maria Bartiromo: Don\u2019t censor her and don\u2019t call her a conspiracy theorist. She said she believes Trump was the victim of an attempted coup that began even before his election
election general	Why Trump supporters are here for good
election general	BLM Attacks Pro-Trump Black Woman Pushing Stroller after D.C. Rally
election general	Protesters Stomp on Trump Supporter's Head After D.C. Rally
election general	Sanders to Trump: \u2018Man-Up\u2019 and Say You Lost the Election
election challenge	'Far from over': 'MAGA' diehards pledge allegiance to Trump at Supreme Court
election challenge	Trump Lawyer Sidney Powell: 'We\u2019re Getting Ready to Overturn Election Results in Multiple States'
election general	"After attacking them earlier in the streets, Antifa and BLM now harassing Trump supporters at restaurants and hotels in DC"
domestic policy/politics	Joe Biden Promises to Raise Annual U.S. Refugee Target by 800%
domestic policy/politics	"'I'm NOT Hunter Biden, lunchbox.' Dana Loesch takes down HORDE of frothy-mouthed, chest-thumping harpies trying to #FireGinaCarano"
domestic policy/politics	Jon Meacham Fired By MSNBC for Failure to Disclose Writing Biden Speech He Praised On The Air
election general	Giuliani: Trump 'Far From' Conceding Election To Biden
domestic policy/politics	Confirmed: Biden Cancer Initiative Spent on Salaries -- and Little Else
pandemic	"Biden COVID Advisory Board Member: Indoor Dining, Gyms, and Gatherings in Homes Should Be Targeted \u2018for Closures\u2019"
election challenge	Trump: Georgia's Election Recount a 'Waste of Time' -- officials won't allow his campaign's observers to be in the counting rooms
election general	"For First Time, Trump Says Biden \u2018Won,\u2019 But Again Claims \u2018Election Was Rigged\u2019 | The Daily Wire"
election general	"Antifa Goes Wild in D.C., Attacking Trump Supporters, Even Terrorizing Children and the Elderly"
domestic policy/politics	Fox News Anchor Blows Up on Trump Spokeswoman as the Descent Continues
domestic policy/politics	CNN\u2019s Acosta Projecting: Trump Will Become Just \u2018Another Crackpot On The Internet\u2019 After Jan. 20 | The Daily Wire
election challenge	"Massive Crowds March in DC to Show Support for Trump, Demand Election Integrity"
election general	Leftists Violently Attack Trump Supporters In Nation\u2019s Capital Following \u2018MAGA March\u2019 | The Daily Wire
domestic policy/politics	Trump Card?
domestic policy/politics	"Joe Biden promises to raise annual number of refugees admitted to US from 15,000 to at least 125,000"
election general	Biden's 'I'm no Trump' campaign is not enough to govern
domestic policy/politics	Post-election announcement of vaccine ripped by White House -- Biden was notified of vaccine the night before while WH only learned through news reports.
election general	"Violent Left Terrorizes DC: BLM Thug Holding \u201cTrump Pence Out Now!\u201d Sign Sucker Punches, Knocks Out White Male From Behind [VIDEOS]"
election general	Trump Makes Appearance At \u2018Million MAGA March\u2019 In D.C. | The Daily Wire
domestic policy/politics	Gov. Kristi Noem won't comply with Biden face mask mandate: He 'doesn't have the authority'
pandemic	President Trump: COVID vaccine should be approved in coming weeks
election general	Million MAGA March: Supporters explain why they're still backing Trump
election general	Violence erupts in DC as counter-protesters assault Trump supporters
election general	'Ready To Help': Biden Spoke At PA Election Board Chairman's Party
domestic policy/politics	CNN\u2019s Acosta: Trump Will Become Just \u2018Another Crackpot On The Internet\u2019 After Jan. 20 | The Daily Wire
domestic policy/politics	Violence occurs after rally in the nation's capital; Trump calls out Antifa
election general	"For those of you wondering, here's a podcast where Giuliani lays out current legal cases and the path remaining for Trump. Great listen!"
domestic policy/politics	Biden Transition Official Believes the First Amendment Has a 'Design Flaw' -- His Remedy Is to Curb Free Speech
election challenge	Trump rails against Georgia recount process
foreign relations	'Sigh of Relief': U.N. Joins Globalist Agencies to Await Biden Handouts
election general	Trump supporters protests turn into violent clashes with anti-demonstrators
election challenge	"Pennsylvania Won't Need a Recount to Certify Biden Victory, State Says"
election general	Biden\u2019s Media Campaign
election general	US election: Trump appears to admit Biden victory in tweet
election general	"For President Trump, a larger fight endures after 2020 election"
domestic policy/politics	DHS boss Chad Wolf defies Trump order to fire cyber chief Chris Krebs
domestic policy/politics	Lindsey Graham fires back after top Democrat demands no more hearings for Trump's judicial nominees
election general	PHOTOS: Donald Trump Thrills D.C. Supporter Rally with Motorcade Drive-By
election challenge	Pennsylvania Court Denies 5 Trump Campaign Legal Challenges
election general	"CHAOS As BLM Terrorize Trump Supporters: \u2018Radical Revolution Changes the World B*tch,\"" [VIDEO]"
foreign relations	"Logan Act: Communist China Congratulates Biden on 'Victory,' Opens Backchannel Talks"
election challenge	Trump Campaign Asks Pennsylvania Federal Judge To Order State To Provide Information About Mailed-In Ballots
election challenge	"Pennsylvania, Michigan, Wisconsin: Here's an Update on Team Trump's Lawsuits and Recounts"
domestic policy/politics	(Clinton) Federal Judge Invalidates Trump Administration's DACA Rollback
election general	"\""Violence erupts in DC as counter-protesters fight Trump supporters\"""
domestic policy/politics	First African-American Miss USA distances herself from Trump after social media backlash.
election general	ANTIFA and BLM demonstrate Biden's UNITY by physically assaulting PEACEFUL Pro-Trump MAGA Marchers
domestic policy/politics	Durham\u2019s Lame Duck Period: Democratic Leaders Suggest A Dim Future For Biden-Related Investigations
election general	Cindy McCain Says Late Husband Would Want Country to \u2018Move on\u2019 and Support Joe Biden
election general	Law Firm Targeted by Cancel Culture Will No Longer Represent the Trump Campaign
election general	Trump leaves 2024 door open with fundraising push
election general	Victor Hansen: Will President Trump Ride Off Into the Sunset? (Shane...)
election general	Trump supporters descend upon Washington to defend the president Despite Defeat
election general	Trump walks back tweet saying Biden 'won' election
foreign relations	Trump laying groundwork for full US troop withdrawal from Afghanistan before leaving office
foreign relations	"China Expert: Beijing Happy With Biden Win. \u201cI think China is very happy with how things turned out, because Beijing worked very hard to get the vice president elected\u201d by malicious and massive attacks on President Donald Trump through a public disinformation campaign."
pandemic	"BREAKING: New Vaccine Developed In Conjunction With Trump\u2019s \u2018Operation Warp Speed\u2019 Is 94.5% Effective, Company Says"
pandemic	Rand Paul Vows to Prevent Biden Lockdown -- 'We Can't Go on Like This Forever'
domestic policy/politics	"Obama Compares Trump To Dictator During Interview, Gets Slammed Online For Hypocrisy | The Daily Wire"
pandemic	"Covid is so bad that Robert Reich wants to forget that pesky Constitution and just install Biden as President right now. No, I'm not kidding. This is a real tweet. Reich served in the Ford, Carter, Clinton and Obama administrations."
domestic policy/politics	If You Haven\u2019t Quit Watching FOX News Yet\u2026 Watch this Clip of Leland Vittert laughing at a Trump Spokeswoman
election challenge	1.7 Million Trump Votes Deleted By Dominion Voting System Nationwide.
election challenge	"New federal lawsuit seeks to throw out 1.2 million votes in Michigan, flipping the state for Trump"
domestic policy/politics	Israel Demands CNN Apology over Amanpour Likening Trump\u2019s Tenure to Nazi Germany
election general	Where's Biden? The silence from 'Mr. Unity' over violent attacks to Trump supporters is deafening
pandemic	Biden COVID Advisor: Those Older Than 75 Should Get Vaccines Last -- American's should be deeply troubled that a man Biden is looking to for advice on COVID is someone who hopes to die at 75 and has publicly supported rationing care for the elderly.
domestic policy/politics	The Real 'Authoritarian' Isn't Trump. It's The Left
domestic policy/politics	"Joe Biden's Student Loan Debt Forgiveness Plan Will Cancel up to $50,000 per Student"
foreign relations	President Trump\u2019s Final 2020 Act Should Be Pulling U.S. Out From Endless Wars -- A reprioritization of America\u2019s strategic interests would cement the legacy of the first president in the era of great-power rivalry.
election general	Pollster: It's Curious How Biden Underperformed Hillary Clinton In Every City...Except These Four.
pandemic	"\u201cModerna's coronavirus vaccine is 94.5 per cent effective, according to company data\u201d Trump REALLY wasn\u2019t lying.."
election challenge	"Forget Finding Fraud, Trump May Seek to Deny Biden 270 Electoral Votes, Put Election in Congress"
