topic	title
domestic policy/politics	Biden Fills Economic Posts With Experts on Systemic Racism
domestic policy/politics	Bill O'Reilly Predicts 'Collapse' Of Cable News Networks Post-Trump
foreign relations	Scoop: Trump plans last-minute China crackdown
pandemic	"Emboldened by Biden, the Lockdown Fascists Return for Round 3. The political \u201cScience!\u201d leaders will all keep showing up to press conferences with their masks on so that we simple folk can bathe in the healing power of virtue-signalling."
domestic policy/politics	Obama Compares Trump to Dictator -- 'There Has Been a Sense' He Would 'Do Anything to Stay in Power'
election challenge	"The Dominion software story keeps getting worse: the person in charge of the software\u2019s security, is an Antifa supporter and Trump hater"
domestic policy/politics	Trump allies raising millions for new conservative TV network: report
foreign relations	Outgoing Diplomat Admits Lying to President Trump About American Troop Numbers in Syria
domestic policy/politics	Biden\u2019s Tax Returns Prove He\u2019s a Scrooge When It Comes to Donating to Charity
domestic policy/politics	"NASA boss Jim Bridenstine may resign if Joe Biden takes control of the White House, which would likely delay the 2024 Moon Landing and subsequent Mars colonization mission"
election challenge	Trump Campaign Rejects Media Reports of Changed Pennsylvania Case
domestic policy/politics	"Companies Are Preparing to Cut Jobs and Automate if Biden Gets $15 Minimum Wage Hike, Reporting Shows"
domestic policy/politics	"Obama, with a net worth of $70MM, calls Trump 'Richie Rich'"
pandemic	"Today Governor Cuomo threatened to sue the Trump administration if it moves ahead with its COVID-19 vaccine-distribution plan, which he called discriminatory \u2014 after the president threatened to move New York at the back of the line for getting the shot."
domestic policy/politics	Trump Allies Considering Raising $200 Million For Fox News Alternative | The Daily Wire
election general	Small-Town Trump Rally One Of Many Unreported By Corporate Media -- The corporate media gave little to no coverage of the organic Trump rallies that erupted in cities and towns across America in solidarity with the DC march.
domestic policy/politics	The U.S. Economy\u2019s Remarkable Recovery Continues As Biden Plans To Crush It
domestic policy/politics	"Silicon Valley eager for Biden to reverse Trump visa rules, hire more immigrants"
election general	Black Lives Matter And Antifa Assault Trump Supporters After DC March
election challenge	The 2020 election took place under a Trump-declared \u201cNational Emergency\u201d that set an Election Day trap for the \u201cunauthorized accessing of election and campaign infrastructure\u201d
election general	"The inevitability of Trump 2024 - As long as there is an audience, he will go on"
pandemic	The COVID Lockdown Rut. Biden\u2019s \u2018new\u2019 plan is more of the same insanity: life lived through our smartphones and screens.
election challenge	"Dershowitz: Trump May Seek to Deny Biden 270 Electoral Votes, Put Election in Congress"
election challenge	"Peter Neffenger, chairman of the board of Smartmatic voting software used by Dominion is on Joe Biden's DHS transition team."
election general	Not-So-Magic Mike? Bloomberg Spent $100M in 3 Key States That Trump Still Won
election general	Leftist Goons Gruesomely Stomp on Trump Supporter\u2019s Head After MAGA Rally
domestic policy/politics	\u2018Things Are Going to Get Easier\u2019: E.U. Dreams of a Subservient U.S. Under Joe Biden
election challenge	"If the election does go to the state legislators, that\u2019s where we all come in. Trump supporters have to put so much pressure on these legislators that they do what\u2019s right, not what\u2019s easy."
election general	"WATCH: D.C. Cops Direct Trump-Supporters into Gauntlet of Protesters, Do Nothing When They Are Assaulted"
pandemic	Gov. Cuomo: Trump Attacks Me Over COVID Vaccine Because 'He Doesn't Like That I Criticize Him' -- 'Typical Bully'
election general	Man Begs Internet To Stop Making Him Defend Trump
domestic policy/politics	Sanders 'Fully' Expects Biden to Back the Biden-Sanders Manifesto: 'These Are Not Far-Left Ideas'
election challenge	Trump attorney Rudy Giuliani claims presidential election will be \u2018overturned\u2019
domestic policy/politics	"Jim Acosta: After January 20th, Trump Will Become 'Another Crackpot on the Internet' (How the hell does Acosta think that Trump will magically become Acosta after the swearing in?)"
election challenge	"Biden Campaign Operative, Texas State Senator Accused of Mail-in Ballot Fraud"
election general	\u201cThe First Thing We Do\u201d: The Lawless Campaign To Harass Lawyers Representing The Trump Campaign
domestic policy/politics	"Pelosi, Hoyer supposedly telling members not to join Team Biden"
election general	House leaders urge Congressional Democrats not to join Biden administration because their majority will be razor thin
domestic policy/politics	James Woods exposes dozens of local news shows reading from the same (Biden) script
domestic policy/politics	Bernie pushes Biden to adopt socialism: Sanders says majority of Americans support a 'far-left agenda' - and he'd like a position in Joe's cabinet
foreign relations	"Democrats, Media Stand On The Graves Of European Jews To Hit Trump"
election challenge	Was Election Software Rigged? Sidney Powell Lays Out the Trump Team's Findings.
election challenge	"Trump Campaign Files Suit, Asks Judge to Block PA From Certifying Election Results. Filing states that PA \""county officials illegally allowed voters to use deficient ballots to cast replacement absentee mail-in ballots\"""
pandemic	Trump coronavirus adviser Scott Atlas urges Michigan to 'rise up' against new Covid-19 measures
foreign relations	"A Post-Trump Foreign Policy Should Keep America First. Here\u2019s How -- Whenever Trump leaves office, Republicans should devote themselves to fleshing out elements of his agenda that went unfulfilled. Foremost among these should be foreign policy."
election general	Obama: Why Did Populist Republicans Rally Around 'Richie Rich' Trump?
domestic policy/politics	NY Post: How much research funding did Biden's cancer charity provide?
election general	Why did Donald Trump do better than expected in the U.S. election?
domestic policy/politics	Biden\u2019s Foolish Immigration Priorities
domestic policy/politics	Always Never Trump
election challenge	"After Four Years of \u2018the Resistance,\u2019 Trump Is Right to Challenge the Election Results: If denying President Trump\u2019s legitimacy for the past five years was okay, why is taking this one to court suddenly a threat to democracy?"
election general	Here's Why the Pollsters Underestimated the Trump Vote By So Much (1.5-minute audio clip from The All-In Podcast)
pandemic	"Like My Friend Franz Kafka, I\u2019ve Got The Best COVID Rules For Joe Biden -- Restaurants must close at 10 p.m., except on Wednesdays, when they must close at 9 p.m., and Sundays, when they must close at 3 p.m. but cannot open until 4 p.m."
domestic policy/politics	The Grand New Party: Here\u2019s What\u2019s In Store For The Republican Party Without Trump At The Helm
domestic policy/politics	"[An oldie but a goodie, and maybe our national future under Biden/Harris] Wisconsin\u2019s Shame: \u2018I Thought It Was a Home Invasion\u2019"
pandemic	Cuomo threatens to sue Trump administration over vaccine distribution plan
domestic policy/politics	"\u2018Bury Trump In A Nazi Graveyard,\u2019 Alec Baldwin Says | The Daily Wire"
election general	Bolton: GOP Leaders Need to Explain to Trump Voters He Lost
election general	Ilhan Omar: Biden Won Because Of GOP \u2018Chaos\u2019 | The Daily Wire
domestic policy/politics	House leaders urge Democrats not to join team Biden to maintain majority
domestic policy/politics	CSPAN Clip: Biden describing the dying off and replacement of whites in America
pandemic	Fauci: Coronavirus Task Force Should Begin Meeting with Biden's Transition Team
pandemic	Biden wants mask mandates nationwide: \u2018We can save tens of thousands of lives
foreign relations	"'If you have to sleep with her, do it': a Hunter Biden-linked firm's pursuit of Russian money"
domestic policy/politics	"Biden Cancer Charity Spends Entire Budget On Salaries, Zero On Research"
election challenge	Pro-Trump Wisconsin Lawyers Spike Election Lawsuit on Morning of Court Hearing
domestic policy/politics	Media Praise Joe Biden\u2019s \u2018Solid Catholic Faith\u2019
election challenge	Trump lashes out after campaign reportedly scraps key claim in Pennsylvania suit
